,naic_cd,naics_code_description,total_flsa_bw_atp_amt,total_flsa_ee_atp_cnt,total_observations,num_firms,num_establishments,num_employed,payroll,receipts,flsa_severity_idx,flsa_reported_rt,flsa_suscptbl_idx
"('32619', 'Other Plastics Product Manufacturing')",32619,Other Plastics Product Manufacturing,0.0,0.0,38,23136,25761,1152612,41574193,221371383,,0.0329685965442,
"('326191', 'Plastics Plumbing Fixture Manufacturing')",326191,Plastics Plumbing Fixture Manufacturing,1047.53,1.0,8,1777,1872,66809,2126537,9920174,0.0156794743223,0.119744345822,0.13094125
"('326192', 'Resilient Floor Covering Manufacturing')",326192,Resilient Floor Covering Manufacturing,0.0,0.0,2,167,190,11085,576213,3935630,,0.180423996392,
"('326199', 'All Other Plastics Product Manufacturing')",326199,All Other Plastics Product Manufacturing,545.35,2.0,133,21235,23699,1074718,38871443,207374616,0.000507435438878,0.123753393914,0.00410037593985
"('3262', 'Rubber Product Manufacturing')",3262,Rubber Product Manufacturing,36923.18,14.0,5,5924,7064,350433,14982073,87768031,0.105364449124,0.0142680626539,7.384636
"('32621', 'Tire Manufacturing')",32621,Tire Manufacturing,0.0,0.0,9,1612,2046,125422,6423100,38339983,,0.07175774585,
"('326211', 'Tire Manufacturing (except Retreading)')",326211,Tire Manufacturing (except Retreading),0.0,0.0,14,287,375,102357,5641692,33483581,,0.136776185312,
"('326212', 'Tire Retreading')",326212,Tire Retreading,989.48,4.0,15,1339,1671,23065,781408,4856402,0.0428996314763,0.650336006937,0.0659653333333
"('32622', 'Rubber and Plastics Hoses and Belting Manufacturing')",32622,Rubber and Plastics Hoses and Belting Manufacturing,29646.94,28.0,1,648,796,45076,1737465,9986567,0.657710089626,0.0221847546366,29.64694
"('326220', 'Rubber and Plastics Hoses and Belting Manufacturing')",326220,Rubber and Plastics Hoses and Belting Manufacturing,9775.2,4.0,7,648,796,45076,1737465,9986567,0.216860413524,0.155293282456,1.39645714286
"('32629', 'Other Rubber Product Manufacturing')",32629,Other Rubber Product Manufacturing,2707.31,0.5,4,3708,4222,179935,6821508,39441481,0.0150460444049,0.0222302498124,0.6768275
"('326291', 'Rubber Product Manufacturing for Mechanical Use')",326291,Rubber Product Manufacturing for Mechanical Use,0.0,0.0,2,1498,1707,91493,3449632,17965169,,0.0218595958161,
"('326299', 'All Other Rubber Product Manufacturing')",326299,All Other Rubber Product Manufacturing,0.0,0.0,26,2245,2515,88442,3371876,21476312,,0.293977974266,
"('32711', 'Pottery, Ceramics, and Plumbing Fixture Manufacturing')",32711,"Pottery, Ceramics, and Plumbing Fixture Manufacturing",164.14,1.0,6,3181,3243,53376,1831500,6980354,0.00307516486811,0.112410071942,0.0273566666667
"('327111', 'Vitreous China Plumbing Fixture and China and Earthenware Bathroom Accessories Manufacturing')",327111,Vitreous China Plumbing Fixture and China and Earthenware Bathroom Accessories Manufacturing,0.0,0.0,10,95,111,10909,431450,1924254,,0.916674305619,
"('327112', 'Vitreous China, Fine Earthenware, and Other Pottery Product Manufacturing')",327112,"Vitreous China, Fine Earthenware, and Other Pottery Product Manufacturing",5023.03,0.5,6,2713,2719,25431,650371,2377784,0.197516023751,0.235932523298,0.837171666667
"('327113', 'Porcelain Electrical Supply Manufacturing')",327113,Porcelain Electrical Supply Manufacturing,5048.03,1.0,2,377,413,16880,718357,2580656,0.299053909953,0.118483412322,2.524015
"('32712', 'Clay Building Material and Refractories Manufacturing')",32712,Clay Building Material and Refractories Manufacturing,0.0,0.0,1,1791,2195,81735,3136935,15261762,,0.012234660794,
"('327121', 'Brick and Structural Clay Tile Manufacturing')",327121,Brick and Structural Clay Tile Manufacturing,1972.56,2.0,3,328,550,32210,1103693,4954342,0.0612406085067,0.0931387767774,0.65752
"('327122', 'Ceramic Wall and Floor Tile Manufacturing')",327122,Ceramic Wall and Floor Tile Manufacturing,1456.48,1.5,22,653,681,16431,529775,2260366,0.0886422007182,1.33893250563,0.0662036363636
"('327123', 'Other Structural Clay Product Manufacturing')",327123,Other Structural Clay Product Manufacturing,0.0,0.0,1,183,191,3549,131423,488596,,0.281769512539,
"('327124', 'Clay Refractory Manufacturing')",327124,Clay Refractory Manufacturing,2750.0,0.0,1,369,431,12515,522023,2999707,,0.0799041150619,
"('3272', 'Glass and Glass Product Manufacturing')",3272,Glass and Glass Product Manufacturing,0.0,0.0,2,6672,7369,230077,9646233,51974916,,0.00869274199507,
"('32721', 'Glass and Glass Product Manufacturing')",32721,Glass and Glass Product Manufacturing,0.0,0.0,21,6672,7369,230077,9646233,51974916,,0.0912737909482,
"('327211', 'Flat Glass Manufacturing')",327211,Flat Glass Manufacturing,521.29,2.0,9,198,252,21518,977804,6637644,0.0242257644763,0.418254484618,0.0579211111111
"('327212', 'Other Pressed and Blown Glass and Glassware Manufacturing')",327212,Other Pressed and Blown Glass and Glassware Manufacturing,35081.0,12.0,7,1793,1884,43572,1780687,8403890,0.805127145873,0.160653630772,5.01157142857
"('327213', 'Glass Container Manufacturing')",327213,Glass Container Manufacturing,0.0,0.0,11,105,186,2382,98492,532752,,4.61796809404,
"('327215', 'Glass Product Manufacturing Made of Purchased Glass')",327215,Glass Product Manufacturing Made of Purchased Glass,1913.315,1.0,18,4635,5047,133153,5162913,26563642,0.0143692969742,0.135182834784,0.106295277778
"('3273', 'Cement and Concrete Product Manufacturing')",3273,Cement and Concrete Product Manufacturing,1435.46,2.0,19,18357,29871,590014,25748425,165458599,0.00243292532042,0.0322026257004,0.0755505263158
"('32731', 'Cement Manufacturing')",32731,Cement Manufacturing,396.175,0.5,6,418,759,36768,2178706,21861716,0.0107749945605,0.16318537859,0.0660291666667
"('327310', 'Cement Manufacturing')",327310,Cement Manufacturing,0.0,0.0,18,418,759,36768,2178706,21861716,,0.48955613577,
"('32732', 'Ready-Mix Concrete Manufacturing')",32732,Ready-Mix Concrete Manufacturing,217.5,0.5,20,8540,17230,272301,12242771,87321705,0.000798748443818,0.0734481327648,0.010875
"('327320', 'Ready-Mix Concrete Manufacturing')",327320,Ready-Mix Concrete Manufacturing,9708.65,5.5,76,8540,17230,272301,12242771,87321705,0.0356541107084,0.279102904506,0.127745394737
"('32733', 'Concrete Pipe, Brick, and Block Manufacturing')",32733,"Concrete Pipe, Brick, and Block Manufacturing",4929.0,3.0,3,2661,3977,95314,4153198,24496205,0.0517132845122,0.0314749144931,1.643
"('327331', 'Concrete Block and Brick Manufacturing')",327331,Concrete Block and Brick Manufacturing,58.18,1.0,15,2068,2919,60687,2638749,15866125,0.000958689669946,0.247169904592,0.00387866666667
"('327332', 'Concrete Pipe Manufacturing')",327332,Concrete Pipe Manufacturing,0.0,0.0,1,626,1058,34672,1514449,8630080,,0.028841716659,
"('32739', 'Other Concrete Product Manufacturing')",32739,Other Concrete Product Manufacturing,211.87,0.5,8,7062,7905,184307,7123101,31326789,0.00114954939313,0.0434058391705,0.02648375
"('327390', 'Other Concrete Product Manufacturing')",327390,Other Concrete Product Manufacturing,0.0,0.0,42,7062,7905,184307,7123101,31326789,,0.227880655645,
"('327410', 'Lime Manufacturing')",327410,Lime Manufacturing,0.0,0.0,3,135,231,9900,526726,4105151,,0.30303030303,
"('327420', 'Gypsum Product Manufacturing')",327420,Gypsum Product Manufacturing,0.0,0.0,5,653,851,27911,1329593,12250402,,0.179140840529,
"('3279', 'Other Nonmetallic Mineral Product Manufacturing')",3279,Other Nonmetallic Mineral Product Manufacturing,2432.76,29.0,1,11147,12208,230552,9547705,52368536,0.0105518928485,0.00433741628787,2.43276
"('32791', 'Abrasive Product Manufacturing')",32791,Abrasive Product Manufacturing,9505.16,12.0,1,1010,1126,33774,1534183,8428451,0.281434239356,0.0296085746432,9.50516
"('327910', 'Abrasive Product Manufacturing')",327910,Abrasive Product Manufacturing,0.0,0.0,4,1010,1126,33774,1534183,8428451,,0.118434298573,
"('32799', 'All Other Nonmetallic Mineral Product Manufacturing')",32799,All Other Nonmetallic Mineral Product Manufacturing,0.0,0.0,3,10152,11082,190063,7639483,40898253,,0.0157842399625,
"('327991', 'Cut Stone and Stone Product Manufacturing')",327991,Cut Stone and Stone Product Manufacturing,467.73,1.0,71,7683,7839,100962,3533420,12459055,0.00463273310751,0.70323488045,0.00658774647887
"('327992', 'Ground or Treated Mineral and Earth Manufacturing')",327992,Ground or Treated Mineral and Earth Manufacturing,2429.84,4.5,4,544,789,18065,869970,6627512,0.134505397177,0.221422640465,0.60746
"('327993', 'Mineral Wool Manufacturing')",327993,Mineral Wool Manufacturing,0.0,0.0,1,650,914,43594,2060468,13538852,,0.0229389365509,
"('327999', 'All Other Miscellaneous Nonmetallic Mineral Product Manufacturing')",327999,All Other Miscellaneous Nonmetallic Mineral Product Manufacturing,0.0,0.0,13,1302,1540,22788,1175625,8272834,,0.570475688959,
"('3311', 'Iron and Steel Mills and Ferroalloy Manufacturing')",3311,Iron and Steel Mills and Ferroalloy Manufacturing,0.0,0.0,10,2788,3061,238168,16011090,220801964,,0.0419871687212,
"('33111', 'Iron and Steel Mills and Ferroalloy Manufacturing')",33111,Iron and Steel Mills and Ferroalloy Manufacturing,0.0,0.0,18,2788,3061,238168,16011090,220801964,,0.0755769036982,
"('331111', 'Iron and Steel Mills')",331111,Iron and Steel Mills,0.0,0.0,47,2729,2999,232103,15659059,216665058,,0.20249630552,
"('331112', 'Electrometallurgical Ferroalloy Product Manufacturing')",331112,Electrometallurgical Ferroalloy Product Manufacturing,31136.45,11.0,4,62,62,5098,295148,3420598,6.10758140447,0.784621420165,7.7841125
"('3312', 'Steel Product Manufacturing from Purchased Steel')",3312,Steel Product Manufacturing from Purchased Steel,0.0,0.0,41,1854,2185,110658,5145202,51995433,,0.370510943628,
"('33121', 'Iron and Steel Pipe and Tube Manufacturing from Purchased Steel')",33121,Iron and Steel Pipe and Tube Manufacturing from Purchased Steel,5415.98,3.0,29,672,803,52806,2556655,23589297,0.102563723819,0.549180017422,0.186757931034
"('331210', 'Iron and Steel Pipe and Tube Manufacturing from Purchased Steel')",331210,Iron and Steel Pipe and Tube Manufacturing from Purchased Steel,155.1,1.0,55,672,803,52806,2556655,23589297,0.00293716623111,1.0415483089,0.00282
"('33122', 'Rolling and Drawing of Purchased Steel')",33122,Rolling and Drawing of Purchased Steel,0.0,0.0,3,1193,1382,57687,2588547,28406136,,0.0520047844402,
"('331221', 'Rolled Steel Shape Manufacturing')",331221,Rolled Steel Shape Manufacturing,0.0,0.0,16,531,585,23798,1207727,17004306,,0.672325405496,
"('331222', 'Steel Wire Drawing')",331222,Steel Wire Drawing,3315.35,5.5,6,682,797,33978,1380820,11401830,0.0975734298664,0.17658484902,0.552558333333
"('3313', 'Alumina and Aluminum Production and Processing')",3313,Alumina and Aluminum Production and Processing,8373.39,7.0,4,1548,1881,147522,7078511,90889201,0.0567602798227,0.0271145998563,2.0933475
"('33131', 'Alumina and Aluminum Production and Processing')",33131,Alumina and Aluminum Production and Processing,0.0,0.0,15,1548,1881,147522,7078511,90889201,,0.101679749461,
"('331311', 'Alumina Refining')",331311,Alumina Refining,10673.7,4.5,2,39,42,430,27881,246004,24.8225581395,4.6511627907,5.33685
"('331312', 'Primary Aluminum Production')",331312,Primary Aluminum Production,186.695,0.5,6,193,217,18479,1057077,13635630,0.010103089994,0.324692894637,0.0311158333333
"('331314', 'Secondary Smelting and Alloying of Aluminum')",331314,Secondary Smelting and Alloying of Aluminum,0.0,0.0,3,384,450,14860,702698,12963225,,0.201884253028,
"('331315', 'Aluminum Sheet, Plate, and Foil Manufacturing')",331315,"Aluminum Sheet, Plate, and Foil Manufacturing",0.0,0.0,11,289,338,37239,2135286,34147016,,0.295389242461,
"('331316', 'Aluminum Extruded Product Manufacturing')",331316,Aluminum Extruded Product Manufacturing,0.0,0.0,15,443,561,61568,2431962,19594195,,0.243633056133,
"('331319', 'Other Aluminum Rolling and Drawing')",331319,Other Aluminum Rolling and Drawing,0.0,0.0,7,260,273,8804,354613,3605650,,0.795093139482,
"('3314', 'Nonferrous Metal (except Aluminum) Production and Processing')",3314,Nonferrous Metal (except Aluminum) Production and Processing,637.47,1.5,8,2557,2999,142972,7672861,122985049,0.00445870520102,0.0559550121702,0.07968375
"('33141', 'Nonferrous Metal (except Aluminum) Smelting and Refining')",33141,Nonferrous Metal (except Aluminum) Smelting and Refining,15554.92,4.0,2,531,600,22124,1315967,32321676,0.703079009221,0.0903995660821,7.77746
"('331411', 'Primary Smelting and Refining of Copper')",331411,Primary Smelting and Refining of Copper,0.0,0.0,1,23,27,3562,238562,16268610,,0.280741156654,
"('331419', 'Primary Smelting and Refining of Nonferrous Metal (except Copper and Aluminum)')",331419,Primary Smelting and Refining of Nonferrous Metal (except Copper and Aluminum),1551.5,9.0,5,508,573,18022,1063776,15935421,0.0860892242814,0.27743868605,0.3103
"('33142', 'Copper Rolling, Drawing, Extruding, and Alloying')",33142,"Copper Rolling, Drawing, Extruding, and Alloying",0.0,0.0,2,601,764,57020,2837105,52495401,,0.0350754121361,
"('331421', 'Copper Rolling, Drawing, and Extruding')",331421,"Copper Rolling, Drawing, and Extruding",0.0,0.0,1,256,348,31279,1504780,34996304,,0.0319703315323,
"('331422', 'Copper Wire (except Mechanical) Drawing')",331422,Copper Wire (except Mechanical) Drawing,0.0,0.0,1,263,316,22076,1076795,13485302,,0.045298061243,
"('331423', 'Secondary Smelting, Refining, and Alloying of Copper')",331423,"Secondary Smelting, Refining, and Alloying of Copper",0.0,0.0,1,95,100,3455,247499,3881870,,0.289435600579,
"('33149', 'Nonferrous Metal (except Copper and Aluminum) Rolling, Drawing, Extruding, and Alloying')",33149,"Nonferrous Metal (except Copper and Aluminum) Rolling, Drawing, Extruding, and Alloying",10422.72,6.0,2,1484,1635,63761,3519789,37903088,0.163465441257,0.0313671366509,5.21136
"('331491', 'Nonferrous Metal (except Copper and Aluminum) Rolling, Drawing, and Extruding')",331491,"Nonferrous Metal (except Copper and Aluminum) Rolling, Drawing, and Extruding",9968.55,12.5,4,855,920,39374,2200406,20791720,0.253175953675,0.101589881648,2.4921375
"('331492', 'Secondary Smelting, Refining, and Alloying of Nonferrous Metal (except Copper and Aluminum)')",331492,"Secondary Smelting, Refining, and Alloying of Nonferrous Metal (except Copper and Aluminum)",0.0,0.0,3,651,715,24387,1319383,17111368,,0.123016361176,
"('3315', 'Foundries')",3315,Foundries,0.0,0.0,2,6453,7005,400640,16806991,83108312,,0.00499201277955,
"('33151', 'Ferrous Metal Foundries')",33151,Ferrous Metal Foundries,0.0,0.0,6,2379,2633,216536,9655208,48458310,,0.0277090183618,
"('331511', 'Iron Foundries')",331511,Iron Foundries,1880.86,1.0,6,1406,1559,130884,6025759,28985622,0.0143704348889,0.0458421197396,0.313476666667
"('331512', 'Steel Investment Foundries')",331512,Steel Investment Foundries,36646.36,53.5,2,344,380,40231,1596300,7015754,0.910898560811,0.0497129079566,18.32318
"('331513', 'Steel Foundries (except Investment)')",331513,Steel Foundries (except Investment),3673.84,12.0,9,669,694,45274,2028337,12422066,0.08114679507,0.19878959226,0.408204444444
"('331521', 'Aluminum Die-Casting Foundries')",331521,Aluminum Die-Casting Foundries,0.0,0.0,11,725,788,52681,2002468,10608516,,0.208803933107,
"('331522', 'Nonferrous (except Aluminum) Die-Casting Foundries')",331522,Nonferrous (except Aluminum) Die-Casting Foundries,0.0,0.0,5,636,662,32647,1248942,6400196,,0.153153429105,
"('331524', 'Aluminum Foundries (except Die-Casting)')",331524,Aluminum Foundries (except Die-Casting),0.0,0.0,4,1529,1596,67522,2578146,10567091,,0.0592399514232,
"('331528', 'Other Nonferrous Foundries (except Die-Casting)')",331528,Other Nonferrous Foundries (except Die-Casting),0.0,0.0,2,418,426,11882,582490,3102558,,0.168321831342,
"('3321', 'Forging and Stamping')",3321,Forging and Stamping,0.0,0.0,1,8310,8929,338241,15169030,85039122,,0.00295647186474,
"('33211', 'Forging and Stamping')",33211,Forging and Stamping,0.0,0.0,5,8310,8929,338241,15169030,85039122,,0.0147823593237,
"('332111', 'Iron and Steel Forging')",332111,Iron and Steel Forging,0.0,0.0,34,1280,1360,59469,2932057,17900218,,0.571726445711,
"('332112', 'Nonferrous Forging')",332112,Nonferrous Forging,3185.09,5.5,2,189,212,19123,1144678,8239974,0.166558071432,0.104586100507,1.592545
"('332114', 'Custom Roll Forming')",332114,Custom Roll Forming,0.0,0.0,1,1124,1307,48555,2269136,19535678,,0.0205952013181,
"('332116', 'Metal Stamping')",332116,Metal Stamping,0.0,0.0,9,5230,5460,181629,7630960,33072829,,0.0495515583965,
"('332117', 'Powder Metallurgy Part Manufacturing')",332117,Powder Metallurgy Part Manufacturing,0.0,0.0,3,373,406,17132,662951,2972062,,0.175110903572,
"('3322', 'Cutlery and Handtool Manufacturing')",3322,Cutlery and Handtool Manufacturing,40151.44,5.0,1,5045,5341,134425,5796891,27776297,0.298690273387,0.00743909243072,40.15144
"('33221', 'Cutlery and Handtool Manufacturing')",33221,Cutlery and Handtool Manufacturing,1152.88,3.0,3,5045,5341,134425,5796891,27776297,0.00857638088153,0.0223172772922,0.384293333333
"('332211', 'Cutlery and Flatware (except Precious) Manufacturing')",332211,Cutlery and Flatware (except Precious) Manufacturing,15237.23,10.5,2,519,524,13402,635907,3393500,1.13693702432,0.149231457991,7.618615
"('332212', 'Hand and Edge Tool Manufacturing')",332212,Hand and Edge Tool Manufacturing,1236.94,3.0,5,3874,4098,96078,4045849,17743571,0.0128743312725,0.0520410499802,0.247388
"('332213', 'Saw Blade and Handsaw Manufacturing')",332213,Saw Blade and Handsaw Manufacturing,13378.31,5.5,2,477,498,14298,673557,3202177,0.935677017765,0.139879703455,6.689155
"('332214', 'Kitchen Utensil, Pot, and Pan Manufacturing')",332214,"Kitchen Utensil, Pot, and Pan Manufacturing",2382.22,3.0,3,201,221,9450,392475,3161120,0.252086772487,0.31746031746,0.794073333333
"('3323', 'Architectural and Structural Metals Manufacturing')",3323,Architectural and Structural Metals Manufacturing,957.0,1.0,17,46683,49034,1125480,46599122,241965827,0.000850303870349,0.0151046664534,0.0562941176471
"('33231', 'Plate Work and Fabricated Structural Product Manufacturing')",33231,Plate Work and Fabricated Structural Product Manufacturing,0.0,0.0,7,18827,19808,486558,21628002,125755990,,0.0143867740331,
"('332311', 'Prefabricated Metal Building and Component Manufacturing')",332311,Prefabricated Metal Building and Component Manufacturing,0.0,0.0,32,2649,2877,80034,3295464,19695238,,0.399830072219,
"('332312', 'Fabricated Structural Metal Manufacturing')",332312,Fabricated Structural Metal Manufacturing,1231.135,1.0,72,12200,12822,308276,14222993,87232066,0.00399361286639,0.23355694248,0.0170990972222
"('332313', 'Plate Work Manufacturing')",332313,Plate Work Manufacturing,0.0,0.0,3,4028,4109,98248,4109545,18828686,,0.0305349727221,
"('33232', 'Ornamental and Architectural Metal Products Manufacturing')",33232,Ornamental and Architectural Metal Products Manufacturing,6216.31,7.5,6,27963,29226,638922,24971120,116209837,0.00972937228644,0.00939081765849,1.03605166667
"('332321', 'Metal Window and Door Manufacturing')",332321,Metal Window and Door Manufacturing,294.83,1.0,75,3975,4386,186778,6589555,34407457,0.00157850496311,0.401546220647,0.00393106666667
"('332322', 'Sheet Metal Work Manufacturing')",332322,Sheet Metal Work Manufacturing,0.0,0.0,76,14273,14928,330821,13525944,59830393,,0.229731486212,
"('332323', 'Ornamental and Architectural Metal Work Manufacturing')",332323,Ornamental and Architectural Metal Work Manufacturing,287.67,1.0,32,9782,9912,121323,4855621,21971987,0.00237110852847,0.263758726705,0.0089896875
"('3324', 'Boiler, Tank, and Shipping Container Manufacturing')",3324,"Boiler, Tank, and Shipping Container Manufacturing",0.0,0.0,3,4449,5064,233758,11292876,73686118,,0.0128337853678,
"('33241', 'Power Boiler and Heat Exchanger Manufacturing')",33241,Power Boiler and Heat Exchanger Manufacturing,0.0,0.0,3,921,991,55996,3008746,14524010,,0.0535752553754,
"('332410', 'Power Boiler and Heat Exchanger Manufacturing')",332410,Power Boiler and Heat Exchanger Manufacturing,0.0,0.0,7,921,991,55996,3008746,14524010,,0.125008929209,
"('33242', 'Metal Tank (Heavy Gauge) Manufacturing')",33242,Metal Tank (Heavy Gauge) Manufacturing,5585.06,4.5,2,2066,2212,95665,4391892,20972674,0.0583814352166,0.020906287566,2.79253
"('332420', 'Metal Tank (Heavy Gauge) Manufacturing')",332420,Metal Tank (Heavy Gauge) Manufacturing,0.0,0.0,13,2066,2212,95665,4391892,20972674,,0.135890869179,
"('33243', 'Metal Can, Box, and Other Metal Container (Light Gauge) Manufacturing')",33243,"Metal Can, Box, and Other Metal Container (Light Gauge) Manufacturing",0.0,0.0,4,1489,1861,82097,3892238,38189434,,0.0487228522358,
"('332431', 'Metal Can Manufacturing')",332431,Metal Can Manufacturing,0.0,0.0,1,243,500,39949,2326818,28865368,,0.0250319156925,
"('332439', 'Other Metal Container Manufacturing')",332439,Other Metal Container Manufacturing,7043.87,7.0,6,1262,1361,41146,1565420,9324066,0.171192096437,0.145822194138,1.17397833333
"('33251', 'Hardware Manufacturing')",33251,Hardware Manufacturing,0.0,0.0,5,2510,2702,104687,4253952,23559705,,0.0477614221441,
"('332510', 'Hardware Manufacturing')",332510,Hardware Manufacturing,1108.43,2.5,10,2510,2702,104687,4253952,23559705,0.0105880386294,0.0955228442882,0.110843
"('3326', 'Spring and Wire Product Manufacturing')",3326,Spring and Wire Product Manufacturing,6153.3,2.0,2,5197,5635,151136,5656928,27866449,0.0407136618675,0.0132331145458,3.07665
"('33261', 'Spring and Wire Product Manufacturing')",33261,Spring and Wire Product Manufacturing,0.0,0.0,6,5197,5635,151136,5656928,27866449,,0.0396993436375,
"('332611', 'Spring (Heavy Gauge) Manufacturing')",332611,Spring (Heavy Gauge) Manufacturing,3121.32,43.0,1,398,409,11561,482823,2637432,0.269987025344,0.0864977078107,3.12132
"('332612', 'Spring (Light Gauge) Manufacturing')",332612,Spring (Light Gauge) Manufacturing,6213.2,2.0,1,981,1141,38715,1547359,6962017,0.160485599897,0.0258297817383,6.2132
"('332618', 'Other Fabricated Wire Product Manufacturing')",332618,Other Fabricated Wire Product Manufacturing,3037.75,2.0,18,3839,4085,100729,3626746,18267000,0.0301576507262,0.178697296707,0.168763888889
"('3327', 'Machine Shops; Turned Product; and Screw, Nut, and Bolt Manufacturing')",3327,"Machine Shops; Turned Product; and Screw, Nut, and Bolt Manufacturing",0.0,0.0,1,94144,95303,1252558,53332344,186630030,,0.000798366223361,
"('33271', 'Machine Shops')",33271,Machine Shops,27.0,0.5,26,82770,83386,908333,38257646,127559950,2.97247815504e-05,0.0286238637152,0.00103846153846
"('332710', 'Machine Shops')",332710,Machine Shops,520.67,1.0,139,82770,83386,908333,38257646,127559950,0.000573214889253,0.153027579093,0.00374582733813
"('33272', 'Turned Product and Screw, Nut, and Bolt Manufacturing')",33272,"Turned Product and Screw, Nut, and Bolt Manufacturing",2470.17,1.0,7,11464,11917,344225,15074698,59070080,0.00717603311787,0.0203355363498,0.352881428571
"('332721', 'Precision Turned Product Manufacturing')",332721,Precision Turned Product Manufacturing,9151.44,7.0,17,8756,8903,226666,9638627,33251359,0.0403741187474,0.0750002205889,0.53832
"('332722', 'Bolt, Nut, Screw, Rivet, and Washer Manufacturing')",332722,"Bolt, Nut, Screw, Rivet, and Washer Manufacturing",0.0,0.0,16,2748,3014,117559,5436071,25818721,,0.136101872251,
"('3328', 'Coating, Engraving, Heat Treating, and Allied Activities')",3328,"Coating, Engraving, Heat Treating, and Allied Activities",0.0,0.0,6,20604,22044,413428,15786268,74640604,,0.0145128051317,
"('33281', 'Coating, Engraving, Heat Treating, and Allied Activities')",33281,"Coating, Engraving, Heat Treating, and Allied Activities",0.0,0.0,5,20604,22044,413428,15786268,74640604,,0.0120940042764,
"('332811', 'Metal Heat Treating')",332811,Metal Heat Treating,1414.28,1.0,6,2098,2485,60178,2752279,11992438,0.0235016118847,0.0997042108412,0.235713333333
"('332812', 'Metal Coating, Engraving (except Jewelry and Silverware), and Allied Services to Manufacturers')",332812,"Metal Coating, Engraving (except Jewelry and Silverware), and Allied Services to Manufacturers",224.5,0.5,26,8911,9525,174021,6608046,41461215,0.00129007418645,0.149407255446,0.00863461538462
"('332813', 'Electroplating, Plating, Polishing, Anodizing, and Coloring')",332813,"Electroplating, Plating, Polishing, Anodizing, and Coloring",719.12,1.0,27,9718,10034,179229,6425943,21186951,0.0040122971171,0.15064526388,0.0266340740741
"('3329', 'Other Fabricated Metal Product Manufacturing')",3329,Other Fabricated Metal Product Manufacturing,0.0,0.0,34,21137,22365,692514,31120365,165632473,,0.04909648036,
"('33291', 'Metal Valve Manufacturing')",33291,Metal Valve Manufacturing,0.0,0.0,4,3489,4008,238304,11305147,64995791,,0.0167852826642,
"('332911', 'Industrial Valve Manufacturing')",332911,Industrial Valve Manufacturing,0.0,0.0,4,1315,1507,88847,4265383,25691838,,0.0450212162482,
"('332912', 'Fluid Power Valve and Hose Fitting Manufacturing')",332912,Fluid Power Valve and Hose Fitting Manufacturing,0.0,0.0,10,1020,1183,85672,4158188,19242982,,0.11672425063,
"('332913', 'Plumbing Fixture Fitting and Trim Manufacturing')",332913,Plumbing Fixture Fitting and Trim Manufacturing,45.0,1.0,9,451,484,25042,1033562,9046325,0.0017969810718,0.35939621436,0.005
"('332919', 'Other Metal Valve and Pipe Fitting Manufacturing')",332919,Other Metal Valve and Pipe Fitting Manufacturing,0.0,0.0,14,770,834,38743,1848014,11014646,,0.361355599721,
"('33299', 'All Other Fabricated Metal Product Manufacturing')",33299,All Other Fabricated Metal Product Manufacturing,881.74,2.0,50,17727,18357,454210,19815218,100636682,0.00194126065036,0.110081239955,0.0176348
"('332991', 'Ball and Roller Bearing Manufacturing')",332991,Ball and Roller Bearing Manufacturing,0.0,0.0,10,350,499,61309,2890250,16997537,,0.163108189662,
"('332992', 'Small Arms Ammunition Manufacturing')",332992,Small Arms Ammunition Manufacturing,1263.075,5.5,10,366,372,17180,776745,3996244,0.0735200814901,0.58207217695,0.1263075
