,naic_cd,naics_code_description,total_flsa_bw_atp_amt,total_flsa_ee_atp_cnt,total_observations,num_firms,num_establishments,num_employed,payroll,receipts,flsa_severity_idx,flsa_reported_rt,flsa_suscptbl_idx
"('525930', 'Real Estate Investment Trusts')",525930,Real Estate Investment Trusts,5498.9,3.0,11,3393,6305,56315,5535938,57963599,0.0976453875522,0.195329841073,0.4999
"('52599', 'Other Financial Vehicles')",52599,Other Financial Vehicles,0.0,0.0,19,4160,4198,18532,1426513,7297056,,1.02525361537,
"('525990', 'Other Financial Vehicles')",525990,Other Financial Vehicles,0.0,0.0,27,4160,4198,18532,1426513,7297056,,1.45693934815,
"('5311', 'Lessors of Real Estate')",5311,Lessors of Real Estate,793.48,1.5,36,378920,426560,1768284,57080602,446436461,0.000448728824103,0.020358720658,0.0220411111111
"('53111', 'Lessors of Residential Buildings and Dwellings')",53111,Lessors of Residential Buildings and Dwellings,1716.89,2.0,164,197454,223863,991344,28027668,211386366,0.00173188116335,0.165431979212,0.0104688414634
"('531110', 'Lessors of Residential Buildings and Dwellings')",531110,Lessors of Residential Buildings and Dwellings,1123.04,1.0,547,197454,223863,991344,28027668,211386366,0.00113284591423,0.551776174567,0.00205308957952
"('53112', 'Lessors of Nonresidential Buildings (except Miniwarehouses)')",53112,Lessors of Nonresidential Buildings (except Miniwarehouses),847.36,2.0,10,110436,117226,516018,22271498,188799171,0.00164211325961,0.0193791689437,0.084736
"('531120', 'Lessors of Nonresidential Buildings (except Miniwarehouses)')",531120,Lessors of Nonresidential Buildings (except Miniwarehouses),1488.65,1.0,32,110436,117226,516018,22271498,188799171,0.00288487998481,0.0620133406199,0.0465203125
"('53113', 'Lessors of Miniwarehouses and Self-Storage Units')",53113,Lessors of Miniwarehouses and Self-Storage Units,11438.67,3.5,16,37556,48109,130055,3102111,21240737,0.0879525585329,0.123024874092,0.714916875
"('531130', 'Lessors of Miniwarehouses and Self-Storage Units')",531130,Lessors of Miniwarehouses and Self-Storage Units,3095.43,2.0,29,37556,48109,130055,3102111,21240737,0.0238009303756,0.222982584291,0.106738965517
"('53119', 'Lessors of Other Real Estate Property')",53119,Lessors of Other Real Estate Property,0.0,0.0,31,34423,37362,130867,3679325,25010187,,0.236881719608,
"('531190', 'Lessors of Other Real Estate Property')",531190,Lessors of Other Real Estate Property,1206.03,1.0,74,34423,37362,130867,3679325,25010187,0.00921569226772,0.565459588743,0.0162977027027
"('5312', 'Offices of Real Estate Agents and Brokers')",5312,Offices of Real Estate Agents and Brokers,0.0,0.0,25,401571,428476,1232302,55615204,302031856,,0.020287234785,
"('53121', 'Offices of Real Estate Agents and Brokers')",53121,Offices of Real Estate Agents and Brokers,1590.5,1.0,35,401571,428476,1232302,55615204,302031856,0.00129067387702,0.028402128699,0.0454428571429
"('531210', 'Offices of Real Estate Agents and Brokers')",531210,Offices of Real Estate Agents and Brokers,1368.29,2.0,153,401571,428476,1232302,55615204,302031856,0.00111035281936,0.124157876884,0.00894307189542
"('5313', 'Activities Related to Real Estate')",5313,Activities Related to Real Estate,60.56,0.5,42,291438,321066,2007075,86821366,244395149,3.01732620854e-05,0.0209259743657,0.0014419047619
"('53131', 'Real Estate Property Managers')",53131,Real Estate Property Managers,1689.79,2.0,187,162857,189027,1589175,64353184,171313251,0.00106331272516,0.117671118662,0.00903631016043
"('531311', 'Residential Property Managers')",531311,Residential Property Managers,1955.86,2.0,899,109627,129786,1129721,38870414,102384596,0.00173127701441,0.795771699384,0.00217559510567
"('531312', 'Nonresidential Property Managers')",531312,Nonresidential Property Managers,962.72,1.0,101,53485,59241,459454,25482770,68928655,0.00209535666247,0.219826141464,0.00953188118812
"('53132', 'Offices of Real Estate Appraisers')",53132,Offices of Real Estate Appraisers,61735.69,7.5,4,64194,65106,167682,6611319,18169252,0.368171240801,0.0238546773059,15.4339225
"('531320', 'Offices of Real Estate Appraisers')",531320,Offices of Real Estate Appraisers,3568.6,4.0,11,64194,65106,167682,6611319,18169252,0.0212819503584,0.0656003625911,0.324418181818
"('53139', 'Other Activities Related to Real Estate')",53139,Other Activities Related to Real Estate,490.16,1.0,48,64678,66933,247392,15689374,54204681,0.00198130901565,0.194024058983,0.0102116666667
"('531390', 'Other Activities Related to Real Estate')",531390,Other Activities Related to Real Estate,1908.54,1.0,166,64678,66933,247392,15689374,54204681,0.00771463911525,0.670999870651,0.0114972289157
"('5321', 'Automotive Equipment Rental and Leasing')",5321,Automotive Equipment Rental and Leasing,1484.76,1.0,7,18181,36640,452791,14938674,102406873,0.00327912878127,0.015459671239,0.212108571429
"('53211', 'Passenger Car Rental and Leasing')",53211,Passenger Car Rental and Leasing,930.32,2.0,27,10708,20036,188398,9799338,65536034,0.00493805666727,0.143313623287,0.0344562962963
"('532111', 'Passenger Car Rental')",532111,Passenger Car Rental,1513.22,1.0,89,8451,17652,169702,5103786,29008902,0.00891692496258,0.524448739555,0.0170024719101
"('53212', 'Truck, Utility Trailer, and RV (Recreational Vehicle) Rental and Leasing')",53212,"Truck, Utility Trailer, and RV (Recreational Vehicle) Rental and Leasing",0.0,0.0,11,7502,16604,131194,5139336,36870839,,0.0838452978033,
"('532120', 'Truck, Utility Trailer, and RV (Recreational Vehicle) Rental and Leasing')",532120,"Truck, Utility Trailer, and RV (Recreational Vehicle) Rental and Leasing",408.75,1.0,39,7502,16604,131194,5139336,36870839,0.00311561504337,0.297269692212,0.0104807692308
"('5322', 'Consumer Goods Rental')",5322,Consumer Goods Rental,3617.03,4.0,6,47147,89001,618418,13618487,59066164,0.00584884333897,0.00970217555116,0.602838333333
"('53221', 'Consumer Electronics and Appliances Rental')",53221,Consumer Electronics and Appliances Rental,0.0,0.0,12,2888,10692,13387,1374474,6064509,,0.896392022111,
"('532210', 'Consumer Electronics and Appliances Rental')",532210,Consumer Electronics and Appliances Rental,4689.6,4.0,48,2888,10692,13387,1374474,6064509,0.350310002241,3.58556808844,0.0977
"('53222', 'Formal Wear and Costume Rental')",53222,Formal Wear and Costume Rental,1274.79,2.0,14,3806,6359,30124,650732,2366946,0.0423180852476,0.4647457177,0.0910564285714
"('532220', 'Formal Wear and Costume Rental')",532220,Formal Wear and Costume Rental,1890.28,1.0,11,3806,6359,30124,650732,2366946,0.0627499668039,0.365157349622,0.171843636364
"('53223', 'Video Tape and Disc Rental')",53223,Video Tape and Disc Rental,524.59,1.0,13,19509,43438,309966,4024644,21263620,0.00169241142577,0.0419400837511,0.0403530769231
"('532230', 'Video Tape and Disc Rental')",532230,Video Tape and Disc Rental,76.67,1.0,40,19509,43438,309966,4024644,21263620,0.000247349709323,0.129046411542,0.00191675
"('53229', 'Other Consumer Goods Rental')",53229,Other Consumer Goods Rental,288.36,1.0,5,21019,28512,217653,7040550,26204353,0.00132486113217,0.02297234589,0.057672
"('532291', 'Home Health Equipment Rental')",532291,Home Health Equipment Rental,1500.1,4.0,16,2980,6573,65096,2532341,10337286,0.0230444266929,0.245790832002,0.09375625
"('532292', 'Recreational Goods Rental')",532292,Recreational Goods Rental,2461.24,3.5,24,6779,7096,27883,669333,2832000,0.0882702722089,0.860739518703,0.102551666667
"('532299', 'All Other Consumer Goods Rental')",532299,All Other Consumer Goods Rental,737.5,3.0,41,11274,14843,124674,3838876,13035067,0.00591542743475,0.328857660779,0.017987804878
"('5323', 'General Rental Centers')",5323,General Rental Centers,0.0,0.0,9,12565,17984,104375,3774274,14228988,,0.0862275449102,
"('53231', 'General Rental Centers')",53231,General Rental Centers,2211.21,3.5,10,12565,17984,104375,3774274,14228988,0.021185245509,0.0958083832335,0.221121
"('532310', 'General Rental Centers')",532310,General Rental Centers,0.0,0.0,39,12565,17984,104375,3774274,14228988,,0.373652694611,
"('5324', 'Commercial and Industrial Machinery and Equipment Rental and Leasing')",5324,Commercial and Industrial Machinery and Equipment Rental and Leasing,0.0,0.0,12,32729,46392,448280,23668789,127305530,,0.0267689836709,
"('53241', 'Construction, Transportation, Mining, and Forestry Machinery and Equipment Rental and Leasing')",53241,"Construction, Transportation, Mining, and Forestry Machinery and Equipment Rental and Leasing",149.38,1.0,22,13162,17776,185376,11111316,65761049,0.00080582168134,0.118677714483,0.00679
"('532411', 'Commercial Air, Rail, and Water Transportation Equipment Rental and Leasing')",532411,"Commercial Air, Rail, and Water Transportation Equipment Rental and Leasing",0.0,0.0,3,2762,2952,20404,1747026,21302112,,0.147029994119,
"('532412', 'Construction, Mining, and Forestry Machinery and Equipment Rental and Leasing')",532412,"Construction, Mining, and Forestry Machinery and Equipment Rental and Leasing",0.0,0.0,29,10412,14824,164972,9364290,44458937,,0.175787406348,
"('53242', 'Office Machinery and Equipment Rental and Leasing')",53242,Office Machinery and Equipment Rental and Leasing,0.0,0.0,3,2756,4930,24775,1404442,10203195,,0.121089808274,
"('532420', 'Office Machinery and Equipment Rental and Leasing')",532420,Office Machinery and Equipment Rental and Leasing,10928.91,3.5,8,2756,4930,24775,1404442,10203195,0.44112653885,0.322906155399,1.36611375
"('53249', 'Other Commercial and Industrial Machinery and Equipment Rental and Leasing')",53249,Other Commercial and Industrial Machinery and Equipment Rental and Leasing,7000.0,4.0,7,16943,23686,234336,10897490,48085848,0.0298716373071,0.0298716373071,1.0
"('532490', 'Other Commercial and Industrial Machinery and Equipment Rental and Leasing')",532490,Other Commercial and Industrial Machinery and Equipment Rental and Leasing,3298.23,4.0,34,16943,23686,234336,10897490,48085848,0.0140747900451,0.145090809777,0.0970067647059
"('53311', 'Lessors of Nonfinancial Intangible Assets (except Copyrighted Works)')",53311,Lessors of Nonfinancial Intangible Assets (except Copyrighted Works),0.0,0.0,1,9338,9565,90321,7159049,56475292,,0.0110716223248,
"('533110', 'Lessors of Nonfinancial Intangible Assets (except Copyrighted Works)')",533110,Lessors of Nonfinancial Intangible Assets (except Copyrighted Works),930.5,0.0,3,9338,9565,90321,7159049,56475292,,0.0332148669745,
"('5411', 'Legal Services')",5411,Legal Services,622.97,2.0,15,717628,745146,3964575,274540831,738247399,0.000157134119042,0.00378350768998,0.0415313333333
"('54111', 'Offices of Lawyers')",54111,Offices of Lawyers,1647.04,1.5,76,667538,688494,3655239,261590595,702225982,0.0004505970745,0.0207920740614,0.0216715789474
"('541110', 'Offices of Lawyers')",541110,Offices of Lawyers,2306.67,2.0,274,667538,688494,3655239,261590595,702225982,0.000631058598357,0.0749608985897,0.00841850364964
"('54119', 'Other Legal Services')",54119,Other Legal Services,0.0,0.0,16,50217,56652,309336,12950236,36021417,,0.0517236920371,
"('541191', 'Title Abstract and Settlement Offices')",541191,Title Abstract and Settlement Offices,3779.74,2.5,70,39210,45109,237684,10505424,28441303,0.0159023745814,0.294508675384,0.0539962857143
"('541199', 'All Other Legal Services')",541199,All Other Legal Services,2439.315,3.0,40,11009,11543,49056,2444812,7580114,0.0497251100783,0.815394651011,0.060982875
"('5412', 'Accounting, Tax Preparation, Bookkeeping, and Payroll Services')",5412,"Accounting, Tax Preparation, Bookkeeping, and Payroll Services",3958.17,3.0,8,426636,460929,3739615,150675645,327828514,0.00105844318199,0.00213925765085,0.49477125
"('54121', 'Accounting, Tax Preparation, Bookkeeping, and Payroll Services')",54121,"Accounting, Tax Preparation, Bookkeeping, and Payroll Services",960.77,2.0,82,426636,460929,3739615,150675645,327828514,0.000256916821651,0.0219273909213,0.0117167073171
"('541211', 'Offices of Certified Public Accountants')",541211,Offices of Certified Public Accountants,2678.4,2.0,129,213637,221481,1362789,76048604,184050417,0.00196538128793,0.0946588209914,0.0207627906977
"('541213', 'Tax Preparation Services')",541213,Tax Preparation Services,1758.65,2.0,190,59920,81744,451903,5699266,16590455,0.00389165373985,0.420444210373,0.00925605263158
"('541214', 'Payroll Services')",541214,Payroll Services,514.7,1.0,50,14619,16953,1108149,42974081,70754772,0.000464468225843,0.0451202861709,0.010294
"('541219', 'Other Accounting Services')",541219,Other Accounting Services,0.0,0.0,79,138805,140751,687070,24406989,52523914,,0.114981006302,
"('5413', 'Architectural, Engineering, and Related Services')",5413,"Architectural, Engineering, and Related Services",464.96,1.0,22,393089,433203,4155610,274977188,705834242,0.00011188730415,0.00529404828653,0.0211345454545
"('54131', 'Architectural Services')",54131,Architectural Services,6309.96,5.5,18,95073,98151,690214,45766079,122291860,0.00914203420968,0.026078868293,0.350553333333
"('541310', 'Architectural Services')",541310,Architectural Services,1904.5,2.0,67,95073,98151,690214,45766079,122291860,0.002759289148,0.0970713430907,0.0284253731343
"('54132', 'Landscape Architectural Services')",54132,Landscape Architectural Services,28.0,0.0,169,25432,25907,140262,6829869,18077329,,1.20488799532,
"('541320', 'Landscape Architectural Services')",541320,Landscape Architectural Services,0.0,0.0,810,25432,25907,140262,6829869,18077329,,5.77490695983,
"('54133', 'Engineering Services')",54133,Engineering Services,544.69,1.0,49,178820,206901,2616553,189185722,483822753,0.000208170826274,0.0187269281379,0.011116122449
"('541330', 'Engineering Services')",541330,Engineering Services,0.0,0.0,270,178820,206901,2616553,189185722,483822753,,0.103189195862,
"('54134', 'Drafting Services')",54134,Drafting Services,10872.45,10.0,6,12303,15426,43436,2162857,5700795,0.250309650981,0.138134266507,1.812075
"('541340', 'Drafting Services')",541340,Drafting Services,3874.8,3.0,21,12303,15426,43436,2162857,5700795,0.0892071093102,0.483469932775,0.184514285714
"('54135', 'Building Inspection Services')",54135,Building Inspection Services,3692.32,4.0,5,22907,23245,69056,2790715,7296066,0.053468489342,0.0724050046339,0.738464
"('541350', 'Building Inspection Services')",541350,Building Inspection Services,0.0,0.0,30,22907,23245,69056,2790715,7296066,,0.434430027804,
"('54136', 'Geophysical Surveying and Mapping Services')",54136,Geophysical Surveying and Mapping Services,0.0,0.0,9,3896,4038,29700,2134364,7616065,,0.30303030303,
"('541360', 'Geophysical Surveying and Mapping Services')",541360,Geophysical Surveying and Mapping Services,322.435,1.0,26,3896,4038,29700,2134364,7616065,0.0108563973064,0.875420875421,0.0124013461538
"('54137', 'Surveying and Mapping (except Geophysical) Services')",54137,Surveying and Mapping (except Geophysical) Services,0.0,0.0,15,36516,37369,238681,9810123,21629695,,0.062845387777,
"('541370', 'Surveying and Mapping (except Geophysical) Services')",541370,Surveying and Mapping (except Geophysical) Services,2198.42,4.0,44,36516,37369,238681,9810123,21629695,0.00921070382645,0.184346470813,0.0499640909091
"('54138', 'Testing Laboratories')",54138,Testing Laboratories,1321.01,3.0,22,19009,22166,305174,15558116,37237963,0.00432871083382,0.072090020775,0.0600459090909
"('541380', 'Testing Laboratories')",541380,Testing Laboratories,1881.63,2.0,65,19009,22166,305174,15558116,37237963,0.00616576117231,0.212993243199,0.0289481538462
"('5414', 'Specialized Design Services')",5414,Specialized Design Services,2589.83,1.0,12,136849,137703,484528,23747580,88268183,0.00534505745798,0.0247663705709,0.215819166667
"('54141', 'Interior Design Services')",54141,Interior Design Services,1905.56,1.0,11,54405,54758,178268,8019661,38825527,0.0106892992573,0.0617048488792,0.173232727273
"('541410', 'Interior Design Services')",541410,Interior Design Services,2287.42,2.0,35,54405,54758,178268,8019661,38825527,0.0128313550385,0.19633361007,0.0653548571429
"('54142', 'Industrial Design Services')",54142,Industrial Design Services,0.0,0.0,7,7506,7616,43101,2654794,7704705,,0.162409224844,
"('541420', 'Industrial Design Services')",541420,Industrial Design Services,0.0,0.0,11,7506,7616,43101,2654794,7704705,,0.255214496183,
"('54143', 'Graphic Design Services')",54143,Graphic Design Services,1590.125,1.5,16,66533,66857,233800,11602905,35372805,0.00680121899059,0.0684345594525,0.0993828125
"('541430', 'Graphic Design Services')",541430,Graphic Design Services,2890.05,2.5,46,66533,66857,233800,11602905,35372805,0.0123612061591,0.196749358426,0.062827173913
"('54149', 'Other Specialized Design Services')",54149,Other Specialized Design Services,1800.0,3.0,31,8423,8472,29359,1470220,6026187,0.0613099901223,1.05589427433,0.058064516129
"('541490', 'Other Specialized Design Services')",541490,Other Specialized Design Services,808.82,3.0,35,8423,8472,29359,1470220,6026187,0.0275493034504,1.19213869682,0.0231091428571
"('5415', 'Computer Systems Design and Related Services')",5415,Computer Systems Design and Related Services,0.0,0.0,91,409372,437241,3540176,273141144,725972604,,0.0257049367037,
"('54151', 'Computer Systems Design and Related Services')",54151,Computer Systems Design and Related Services,0.0,0.0,241,409372,437241,3540176,273141144,725972604,,0.0680757114901,
"('541511', 'Custom Computer Programming Services')",541511,Custom Computer Programming Services,0.0,0.0,535,192426,200498,1529806,121872465,284150150,,0.349717545885,
"('541512', 'Computer Systems Design Services')",541512,Computer Systems Design Services,0.0,0.0,234,165648,180053,1454015,109658024,321766716,,0.160933690505,
"('541513', 'Computer Facilities Management Services')",541513,Computer Facilities Management Services,0.0,0.0,64,12347,14725,232941,17262747,33285977,,0.27474768289,
"('541519', 'Other Computer Related Services')",541519,Other Computer Related Services,0.0,0.0,362,40025,41965,310453,24347908,68011260,,1.16603801542,
"('5416', 'Management, Scientific, and Technical Consulting Services')",5416,"Management, Scientific, and Technical Consulting Services",0.0,0.0,34,565242,586078,2985139,207845718,569823689,,0.0113897543799,
"('54161', 'Management Consulting Services')",54161,Management Consulting Services,0.0,0.0,53,435309,451224,2386398,171214663,453128529,,0.022209203997,
"('541611', 'Administrative Management and General Management Consulting Services')",541611,Administrative Management and General Management Consulting Services,0.0,0.0,120,232296,238866,1240735,97220811,229206585,,0.0967168654064,
"('541612', 'Human Resources Consulting Services')",541612,Human Resources Consulting Services,0.0,0.0,67,53239,57320,424508,30107758,65342659,,0.157829769993,
"('541613', 'Marketing Consulting Services')",541613,Marketing Consulting Services,154.025,1.0,122,98954,100461,434789,25535664,85639991,0.000354252292491,0.280595875241,0.0012625
"('541614', 'Process, Physical Distribution, and Logistics Consulting Services')",541614,"Process, Physical Distribution, and Logistics Consulting Services",0.0,0.0,135,24864,28069,188069,12115517,42761190,,0.717821650564,
"('541618', 'Other Management Consulting Services')",541618,Other Management Consulting Services,0.0,0.0,163,26278,26508,85225,6234913,17278054,,1.91258433558,
"('54162', 'Environmental Consulting Services')",54162,Environmental Consulting Services,0.0,0.0,35,32261,35335,221865,12120171,33684942,,0.157753588894,
"('541620', 'Environmental Consulting Services')",541620,Environmental Consulting Services,0.0,0.0,103,32261,35335,221865,12120171,33684942,,0.464246275888,
"('54169', 'Other Scientific and Technical Consulting Services')",54169,Other Scientific and Technical Consulting Services,0.0,0.0,52,97898,99519,376876,24510884,76026124,,0.137976416646,
"('541690', 'Other Scientific and Technical Consulting Services')",541690,Other Scientific and Technical Consulting Services,0.0,0.0,145,97898,99519,376876,24510884,76026124,,0.384741931033,
"('5417', 'Scientific Research and Development Services')",5417,Scientific Research and Development Services,0.0,0.0,10,52280,60868,1611895,142670105,273937836,,0.00620387804417,
"('54171', 'Research and Development in the Physical, Engineering, and Life Sciences')",54171,"Research and Development in the Physical, Engineering, and Life Sciences",0.0,0.0,16,43370,51302,1469505,132608368,255466904,,0.0108880201156,
"('541710', 'Research and Development in the Physical, Engineering, and Life Sciences')",541710,"Research and Development in the Physical, Engineering, and Life Sciences",0.0,0.0,43,43370,51302,1469505,132608368,255466904,,0.0292615540607,
"('54172', 'Research and Development in the Social Sciences and Humanities')",54172,Research and Development in the Social Sciences and Humanities,1124.62,1.5,2,9016,9566,142390,10061737,18470932,0.00789816700611,0.0140459301917,0.56231
"('541720', 'Research and Development in the Social Sciences and Humanities')",541720,Research and Development in the Social Sciences and Humanities,0.0,0.0,17,9016,9566,142390,10061737,18470932,,0.11939040663,
"('5418', 'Advertising, Public Relations, and Related Services')",5418,"Advertising, Public Relations, and Related Services",0.0,0.0,17,144455,152480,1283806,71998988,246672786,,0.013241876109,
"('54181', 'Advertising Agencies')",54181,Advertising Agencies,0.0,0.0,9,51626,54216,489075,33961691,95046292,,0.0184020855697,
"('541810', 'Advertising Agencies')",541810,Advertising Agencies,2786.485,3.0,40,51626,54216,489075,33961691,95046292,0.00569745948985,0.0817870469764,0.069662125
"('54182', 'Public Relations Agencies')",54182,Public Relations Agencies,0.0,0.0,3,28595,29605,144163,11243630,26970388,,0.0208097778209,
"('541820', 'Public Relations Agencies')",541820,Public Relations Agencies,0.0,0.0,12,28595,29605,144163,11243630,26970388,,0.0832391112838,
"('541830', 'Media Buying Agencies')",541830,Media Buying Agencies,6904.49,4.5,2,3215,3415,29965,2202984,10015746,0.230418488236,0.0667445352912,3.452245
"('54184', 'Media Representatives')",54184,Media Representatives,0.0,0.0,4,7627,8390,56194,3290454,11821139,,0.0711819767235,
"('541840', 'Media Representatives')",541840,Media Representatives,0.0,0.0,9,7627,8390,56194,3290454,11821139,,0.160159447628,
"('54185', 'Display Advertising')",54185,Display Advertising,0.0,0.0,9,8305,9266,87351,3896360,22236141,,0.103032592643,
"('541850', 'Display Advertising')",541850,Display Advertising,1867.13,2.0,26,8305,9266,87351,3896360,22236141,0.0213750271892,0.297649712081,0.0718126923077
"('54186', 'Direct Mail Advertising')",54186,Direct Mail Advertising,318.55,0.5,6,11343,12026,200890,8291172,33272788,0.0015856936632,0.0298670914431,0.0530916666667
"('541860', 'Direct Mail Advertising')",541860,Direct Mail Advertising,1452.21,1.5,26,11343,12026,200890,8291172,33272788,0.00722888147743,0.12942406292,0.0558542307692
"('54187', 'Advertising Material Distribution Services')",54187,Advertising Material Distribution Services,1105.26,1.0,10,2935,3166,37597,1527901,7005251,0.0293975583158,0.265978668511,0.110526
"('541870', 'Advertising Material Distribution Services')",541870,Advertising Material Distribution Services,3336.26,4.0,21,2935,3166,37597,1527901,7005251,0.0887373992606,0.558555203873,0.15886952381
"('54189', 'Other Services Related to Advertising')",54189,Other Services Related to Advertising,685.49,2.0,12,31094,32396,235148,7482251,39568603,0.00291514280368,0.0510316906799,0.0571241666667
"('541890', 'Other Services Related to Advertising')",541890,Other Services Related to Advertising,1297.52,2.0,35,31094,32396,235148,7482251,39568603,0.00551788660758,0.14884243115,0.037072
"('5419', 'Other Professional, Scientific, and Technical Services')",5419,"Other Professional, Scientific, and Technical Services",0.0,0.0,22,253421,274903,1927618,66805730,208387969,,0.011413049681,
"('54191', 'Marketing Research and Public Opinion Polling')",54191,Marketing Research and Public Opinion Polling,502.99,0.5,12,17771,20126,305285,14065667,41232172,0.00164760797288,0.0393075323059,0.0419158333333
"('541910', 'Marketing Research and Public Opinion Polling')",541910,Marketing Research and Public Opinion Polling,138.85,1.0,34,17771,20126,305285,14065667,41232172,0.000454820905056,0.111371341533,0.00408382352941
"('54192', 'Photographic Services')",54192,Photographic Services,130.0,1.0,15,54453,67049,253796,6207610,21314827,0.000512222414853,0.0591025863292,0.00866666666667
"('541921', 'Photography Studios, Portrait')",541921,"Photography Studios, Portrait",827.11,1.0,42,38316,50722,206405,4131370,14133715,0.00400721881737,0.203483442746,0.0196930952381
"('541922', 'Commercial Photography')",541922,Commercial Photography,4602.605,5.5,6,16155,16327,47391,2076240,7181112,0.0971198117786,0.126606317655,0.767100833333
"('54193', 'Translation and Interpretation Services')",54193,Translation and Interpretation Services,221.26,1.0,11,7614,7785,41201,1960659,5603814,0.00537025800345,0.266983811073,0.0201145454545
"('541930', 'Translation and Interpretation Services')",541930,Translation and Interpretation Services,0.0,0.0,43,7614,7785,41201,1960659,5603814,,1.04366398874,
"('54194', 'Veterinary Services')",54194,Veterinary Services,949.98,2.0,65,103102,107371,1003579,29164942,85339731,0.000946592146707,0.0647681946314,0.0146150769231
"('541940', 'Veterinary Services')",541940,Veterinary Services,2229.1,4.0,367,103102,107371,1003579,29164942,85339731,0.00222115050235,0.365691191227,0.00607384196185
"('54199', 'All Other Professional, Scientific, and Technical Services')",54199,"All Other Professional, Scientific, and Technical Services",0.0,0.0,94,70502,72572,296255,14574838,52784217,,0.317294222882,
"('541990', 'All Other Professional, Scientific, and Technical Services')",541990,"All Other Professional, Scientific, and Technical Services",0.0,0.0,347,70502,72572,296255,14574838,52784217,,1.1712882483,
